{
    "id": "d901c6d8-3814-4f8d-9fef-72e9bebf4409",
    "truescript_version": "0.1.0",
    "name": "Variable Assignment",
    "description": "Testing variable assingment",
    "environment": "development",
    "item_id": 1,
    "tags": [
        "example",
        "noerror"
    ],
    "params": {
        "filter": "all*",
        "order_by": "date65",
        "order_desc": "desc"
    },
    "result": {
        "result": "error"
    },
    "script": "$var1 = 100;\r\n$var2=\"Teste\""
}